<?xml version="1.0"?>
<!DOCTYPE Report
[
<!ELEMENT Report (General ,(Doc|BPT)) >
<!ATTLIST Report ver CDATA #REQUIRED tmZone CDATA #REQUIRED>

<!ELEMENT General ( DocLocation ) >
<!ATTLIST General productName CDATA #REQUIRED productVer CDATA #REQUIRED os CDATA #REQUIRED host CDATA #REQUIRED qcserver CDATA #IMPLIED qcproject CDATA #IMPLIED SolManSolutionId CDATA #IMPLIED SolManProjectId CDATA #IMPLIED SolManTestPlanId CDATA #IMPLIED SolManTestPackageId CDATA #IMPLIED SolManUserInfoData CDATA #IMPLIED  >

<!ELEMENT BPT (DName,Res,DVer?,TSet?,TInst?,NodeArgs,AdditionalInfo*,Doc*) >
<!ATTLIST BPT rID ID #REQUIRED >

<!ELEMENT Doc (DName,ConfName?,Res,DVer?,TSet?,TInst?,RunType?,DT?,AdditionalInfo*,Step*,DIter*,Step*,Action*,Doc*,Summary?,TestMaintenanceSummary*,NodeArgs?) >
<!ATTLIST Doc rID ID #REQUIRED type (Test|BC|BPTWrapperTest|Flow|Group|Action) "Test" productName CDATA #REQUIRED BCIter CDATA #IMPLIED >

<!ELEMENT RunType ( #PCDATA )>
<!ATTLIST RunType fmStep (False|True) "False" batch (False|True) "False" upDesc (False|True) "False" upChk (False|True) "False" upAS (False|True) "False">

<!ELEMENT DName ( #PCDATA ) >

<!ELEMENT ConfName ( #PCDATA ) >

<!ELEMENT Res ( #PCDATA ) >

<!ELEMENT AdditionalInfo (AdditionalDataName,AdditionalDataValue ) >

<!ELEMENT AdditionalDataName ( #PCDATA ) >

<!ELEMENT AdditionalDataValue ( #PCDATA ) >

<!ELEMENT DVer ( #PCDATA ) >

<!ELEMENT TSet ( #PCDATA ) >

<!ELEMENT TInst ( #PCDATA ) >

<!ELEMENT DIter (Step*,Action+,Summary?,NodeArgs)>
<!ATTLIST DIter rID ID #REQUIRED iterID CDATA #REQUIRED>

<!ELEMENT DocLocation ( #PCDATA )>

<!ELEMENT Action (AName,AIter*,(Step|HtmlStep|Action)*, Summary,ActionMaintenanceSummary*, NodeArgs ) >
<!ATTLIST Action rID ID #REQUIRED>

<!ELEMENT AIter ((Step|HtmlStep|Action)*,DataMapping?, Summary?,NodeArgs) >
<!ATTLIST AIter rID ID #REQUIRED iterID CDATA #REQUIRED isCountable (False|True) "False" >

<!ELEMENT AName ( #PCDATA ) >

<!ELEMENT TestMaintenanceSummary (ActionMaintenanceSummary*) >
<!ATTLIST TestMaintenanceSummary ObjectsAdded CDATA #REQUIRED ObjectsUpdated CDATA #REQUIRED StepsUpdated CDATA #REQUIRED StepsComments CDATA #REQUIRED><!ELEMENT ActionMaintenanceSummary (ObjectChange* ) >
<!ATTLIST ActionMaintenanceSummary Action CDATA #REQUIRED Objects CDATA #REQUIRED Updated CDATA #REQUIRED LinesTotal CDATA #REQUIRED Added CDATA #REQUIRED LinesUpdated CDATA #REQUIRED>

<!ELEMENT ObjectChange  (Hierarchy, PropertyChangeList* ) >
<!ATTLIST ObjectChange Operation CDATA #IMPLIED OriginalRepository CDATA #IMPLIED>

<!ELEMENT PropertyChangeList (PropertyDef*) >

<!ELEMENT PropertyDef (OriginalValue, NewValue) >
<!ATTLIST PropertyDef PropName CDATA #REQUIRED OriginRegularExpression (True|False) "False" NewRegularExpression (True|False) "False" AddedProperty (True|False) "False" >

<!ELEMENT OriginalValue ( #PCDATA )>

<!ELEMENT NewValue ( #PCDATA )>

<!ELEMENT Hierarchy  (ObjectName, Hierarchy*) >
<!ATTLIST Hierarchy MicClass CDATA #REQUIRED>

<!ELEMENT ObjectName  ( #PCDATA ) >

<!ELEMENT Step (Obj,Details,Time,TimeTick* ,(Step|HtmlStep|Doc)*, DataMapping?, NodeArgs) >
<!ATTLIST Step rID ID #REQUIRED retval CDATA #IMPLIED>

<!ELEMENT HtmlStep (HTML,TimeTick*,(Step|HtmlStep|Doc)*,NodeArgs) >
<!ATTLIST HtmlStep rID ID #REQUIRED >

<!ELEMENT Obj ( #PCDATA ) >
<!ATTLIST Obj plainTxt (False|True) "True">

<!ELEMENT Details ( #PCDATA ) >
<!ATTLIST Details plainTxt (False|True) "True">

<!ELEMENT Time ( #PCDATA ) >

<!ELEMENT HTML ( #PCDATA ) >

<!ELEMENT Disp ( #PCDATA ) >

<!ELEMENT TimeTick ( #PCDATA ) >

<!ELEMENT DataMapping ( DataMappedItem* )>
<!ELEMENT DataMappedItem EMPTY >
<!ATTLIST DataMappedItem dsName CDATA #REQUIRED >
<!ATTLIST DataMappedItem rowId CDATA #REQUIRED >

<!ELEMENT NodeArgs (Disp,TopPane?,BtmPane?,ExtendedInfo? )>
<!ATTLIST NodeArgs eType CDATA #REQUIRED icon CDATA #REQUIRED nRep CDATA #REQUIRED UserNote CDATA #IMPLIED filter (False|True) "True">
<!ATTLIST NodeArgs status (Passed|Failed|Done|Warning|Information) "Done">
<!ATTLIST NodeArgs iconSel CDATA #IMPLIED nType CDATA #IMPLIED MovieMarker CDATA "">
<!ATTLIST NodeArgs Source CDATA #IMPLIED SourceLine CDATA #IMPLIED StepFlowItemKey CDATA #IMPLIED >

<!ELEMENT TopPane (Path)>

<!ELEMENT BtmPane ( (Path|WR)?,ASHilite?)>
<!ATTLIST BtmPane vType CDATA "HTML">

<!ELEMENT Path ( #PCDATA ) >

<!ELEMENT ASHilite ( #PCDATA ) >

<!ELEMENT WR ( #PCDATA ) >

<!ELEMENT ExtendedInfo ( StepData ) >

<!ATTLIST ExtendedInfo StepType CDATA #REQUIRED>
<!ELEMENT DT (NodeArgs) >
<!ATTLIST DT rID ID #REQUIRED>

<!ELEMENT Summary (Param*)>
<!ATTLIST Summary sTime CDATA #IMPLIED eTime CDATA #IMPLIED passed CDATA #IMPLIED failed CDATA #IMPLIED warnings CDATA #IMPLIED retval CDATA #IMPLIED stopped (False|True) "False" >

<!ELEMENT Param (ParamName,ParamVal)+ >
<!ATTLIST Param paramInOut (In|Out) "In">

<!ELEMENT ParamName ( #PCDATA ) >

<!ELEMENT ParamVal ( #PCDATA ) >

]
>
<Report ver="2.0" tmZone="India Standard Time">
<General productName="HP Unified Functional Testing" productVer="12.01" os="Windows 7" host="HW1419"><DocLocation><![CDATA[C:\IFSAutomation\Branch_IFS_Documents_Final\Drivers\SuiteDriver]]></DocLocation></General>
<Doc rID="T1"   productName= "HP Unified Functional Testing"  >
<DName><![CDATA[SuiteDriver]]></DName>
<Res><![CDATA[Res261]]></Res>
<DT rID="T2">
<NodeArgs eType="Table" icon="2" nRep="4" filter="False" >
<Disp><![CDATA[Run-Time Data Table]]></Disp>
<BtmPane vType="Table" >
<Path><![CDATA[Default.xls]]></Path>
</BtmPane>
</NodeArgs>
</DT>
<Action rID="T3">
<AName><![CDATA[Action1]]></AName>
<Step rID="T4">
<Obj plainTxt="False" ><![CDATA[SystemUtil]]></Obj>
<Details plainTxt="False" ><![CDATA[SystemUtil]]></Details>
<Time><![CDATA[20-09-2016 - 16:34:34]]></Time>
<TimeTick>1474369474</TimeTick>
<Step rID="T5">
<Obj plainTxt="False" ><![CDATA[Run "iexplore.exe",3]]></Obj>
<Details plainTxt="False" ><![CDATA[Run "iexplore.exe",3]]></Details>
<Time><![CDATA[20-09-2016 - 16:34:34]]></Time>
<TimeTick>1474369474</TimeTick>
<NodeArgs eType="Replay" icon="4" nRep="10" status="Passed" >
<Disp><![CDATA[Run "iexplore.exe",3]]></Disp>
</NodeArgs>
</Step>
<NodeArgs eType="Replay" icon="4" nRep="9" status="Passed" >
<Disp><![CDATA[SystemUtil]]></Disp>
</NodeArgs>
</Step>
<Step rID="T6">
<Obj plainTxt="False" ><![CDATA[Login]]></Obj>
<Details plainTxt="False" ><![CDATA[Browser]]></Details>
<Time><![CDATA[20-09-2016 - 16:34:36]]></Time>
<TimeTick>1474369476</TimeTick>
<Step rID="T7">
<Obj plainTxt="False" ><![CDATA[Login]]></Obj>
<Details plainTxt="False" ><![CDATA[Cannot identify the object "Login" (of class Browser). Verify that this object's properties match an object currently displayed in your application.]]></Details>
<Time><![CDATA[20-09-2016 - 16:34:36]]></Time>
<TimeTick>1474369476</TimeTick>
<Step rID="T8">
<Obj plainTxt="False" ><![CDATA[Login]]></Obj>
<Details plainTxt="False" ><![CDATA[Object's physical description:<br>miccommentproperty = <br>Mercury Class = Browser<br>CreationTime = 0<br>|Title = Login - Windows Internet Explorer<br>openurl = http://www.msn.com/en-in/?cobrand=dell13.msn.com&ocid=DELLDHP&pc=MDDCJS<br>opentitle = <br>Opened By Testing Tool = 0<br>number of tabs = 1<br>Name = Login<br>]]></Details>
<Time><![CDATA[20-09-2016 - 16:34:36]]></Time>
<TimeTick>1474369476</TimeTick>
<NodeArgs eType="Replay" icon="6" nRep="22" status="Warning" nType="Description" >
<Disp><![CDATA[Login]]></Disp>
</NodeArgs>
</Step>
<NodeArgs eType="Replay" icon="5" nRep="21" status="Failed" nType="Run Error" >
<Disp><![CDATA[Login]]></Disp>
</NodeArgs>
</Step>
<NodeArgs eType="Context" icon="5" nRep="20" status="Failed" >
<Disp><![CDATA[Login]]></Disp>
</NodeArgs>
</Step>
<Step rID="T9">
<Obj plainTxt="False" ><![CDATA[Run Error]]></Obj>
<Details plainTxt="False" ><![CDATA[Cannot identify the object &quot;Login&quot; (of class Browser). Verify that this object's properties match an object currently displayed in your application.<BR>Function file: C:\IFSAutomation\Branch_IFS_Documents_Final\Libraries\GeneralLibraries\BusinessFunction.vbs<BR>Line (10): &quot;		Browser(&quot;Login&quot;).Page(&quot;Login&quot;).sync&quot;.]]></Details>
<Time><![CDATA[20-09-2016 - 16:34:36]]></Time>
<TimeTick>1474369476</TimeTick>
<NodeArgs eType="Replay" icon="6" nRep="23" status="Failed" Source="C:\IFSAutomation\Branch_IFS_Documents_Final\Libraries\GeneralLibraries\BusinessFunction.vbs" SourceLine="9" >
<Disp><![CDATA[Run Error]]></Disp>
</NodeArgs>
</Step>
<Step rID="T10">
<Obj ><![CDATA[Login]]></Obj>
<Details ><![CDATA[]]></Details>
<Time><![CDATA[20-09-2016 - 16:34:36]]></Time>
<TimeTick>1474369476</TimeTick>
<NodeArgs eType="User" icon="7" nRep="24" status="Passed" Source="C:\IFSAutomation\Branch_IFS_Documents_Final\Libraries\GeneralLibraries\BusinessFunction.vbs" SourceLine="-1" >
<Disp><![CDATA[Login]]></Disp>
</NodeArgs>
</Step>
<Step rID="T11">
<Obj plainTxt="False" ><![CDATA[Login]]></Obj>
<Details plainTxt="False" ><![CDATA[Browser]]></Details>
<Time><![CDATA[20-09-2016 - 16:35:36]]></Time>
<TimeTick>1474369536</TimeTick>
<Step rID="T12">
<Obj plainTxt="False" ><![CDATA[Login]]></Obj>
<Details plainTxt="False" ><![CDATA[Page]]></Details>
<Time><![CDATA[20-09-2016 - 16:35:36]]></Time>
<TimeTick>1474369536</TimeTick>
<Step rID="T13">
<Obj plainTxt="False" ><![CDATA[TXT_user_name.Exist]]></Obj>
<Details plainTxt="False" ><![CDATA["Object does not exist"]]></Details>
<Time><![CDATA[20-09-2016 - 16:35:36]]></Time>
<TimeTick>1474369536</TimeTick>
<NodeArgs eType="Replay" icon="9" nRep="34" Source="C:\IFSAutomation\Branch_IFS_Documents_Final\Libraries\GeneralLibraries\BusinessFunction.vbs" SourceLine="-1" >
<Disp><![CDATA[TXT_user_name.Exist]]></Disp>
</NodeArgs>
</Step>
<NodeArgs eType="Context" icon="8" nRep="33" Source="C:\IFSAutomation\Branch_IFS_Documents_Final\Libraries\GeneralLibraries\BusinessFunction.vbs" SourceLine="-1" >
<Disp><![CDATA[Login]]></Disp>
</NodeArgs>
</Step>
<NodeArgs eType="Context" icon="5" nRep="32" Source="C:\IFSAutomation\Branch_IFS_Documents_Final\Libraries\GeneralLibraries\BusinessFunction.vbs" SourceLine="-1" >
<Disp><![CDATA[Login]]></Disp>
</NodeArgs>
</Step>
<Step rID="T14">
<Obj ><![CDATA[Login]]></Obj>
<Details ><![CDATA[]]></Details>
<Time><![CDATA[20-09-2016 - 16:35:36]]></Time>
<TimeTick>1474369536</TimeTick>
<NodeArgs eType="User" icon="7" nRep="35" status="Failed" Source="C:\IFSAutomation\Branch_IFS_Documents_Final\Libraries\GeneralLibraries\BusinessFunction.vbs" SourceLine="-1" >
<Disp><![CDATA[Login]]></Disp>
</NodeArgs>
</Step>
<Step rID="T15">
<Obj plainTxt="False" ><![CDATA[Login]]></Obj>
<Details plainTxt="False" ><![CDATA[Browser]]></Details>
<Time><![CDATA[20-09-2016 - 16:36:36]]></Time>
<TimeTick>1474369596</TimeTick>
<Step rID="T16">
<Obj plainTxt="False" ><![CDATA[Login]]></Obj>
<Details plainTxt="False" ><![CDATA[Page]]></Details>
<Time><![CDATA[20-09-2016 - 16:36:36]]></Time>
<TimeTick>1474369596</TimeTick>
<Step rID="T17">
<Obj plainTxt="False" ><![CDATA[TXT_user_password.Exist]]></Obj>
<Details plainTxt="False" ><![CDATA["Object does not exist"]]></Details>
<Time><![CDATA[20-09-2016 - 16:36:36]]></Time>
<TimeTick>1474369596</TimeTick>
<NodeArgs eType="Replay" icon="9" nRep="45" Source="C:\IFSAutomation\Branch_IFS_Documents_Final\Libraries\GeneralLibraries\BusinessFunction.vbs" SourceLine="-1" >
<Disp><![CDATA[TXT_user_password.Exist]]></Disp>
</NodeArgs>
</Step>
<NodeArgs eType="Context" icon="8" nRep="44" Source="C:\IFSAutomation\Branch_IFS_Documents_Final\Libraries\GeneralLibraries\BusinessFunction.vbs" SourceLine="-1" >
<Disp><![CDATA[Login]]></Disp>
</NodeArgs>
</Step>
<NodeArgs eType="Context" icon="5" nRep="43" Source="C:\IFSAutomation\Branch_IFS_Documents_Final\Libraries\GeneralLibraries\BusinessFunction.vbs" SourceLine="-1" >
<Disp><![CDATA[Login]]></Disp>
</NodeArgs>
</Step>
<Step rID="T18">
<Obj ><![CDATA[Login]]></Obj>
<Details ><![CDATA[]]></Details>
<Time><![CDATA[20-09-2016 - 16:36:36]]></Time>
<TimeTick>1474369596</TimeTick>
<NodeArgs eType="User" icon="7" nRep="46" status="Failed" Source="C:\IFSAutomation\Branch_IFS_Documents_Final\Libraries\GeneralLibraries\BusinessFunction.vbs" SourceLine="-1" >
<Disp><![CDATA[Login]]></Disp>
</NodeArgs>
</Step>
<Step rID="T19">
<Obj plainTxt="False" ><![CDATA[Login]]></Obj>
<Details plainTxt="False" ><![CDATA[Browser]]></Details>
<Time><![CDATA[20-09-2016 - 16:37:37]]></Time>
<TimeTick>1474369657</TimeTick>
<Step rID="T20">
<Obj plainTxt="False" ><![CDATA[Login]]></Obj>
<Details plainTxt="False" ><![CDATA[Page]]></Details>
<Time><![CDATA[20-09-2016 - 16:37:37]]></Time>
<TimeTick>1474369657</TimeTick>
<Step rID="T21">
<Obj plainTxt="False" ><![CDATA[BTN_Log In.Exist]]></Obj>
<Details plainTxt="False" ><![CDATA["Object does not exist"]]></Details>
<Time><![CDATA[20-09-2016 - 16:37:37]]></Time>
<TimeTick>1474369657</TimeTick>
<NodeArgs eType="Replay" icon="10" nRep="56" Source="C:\IFSAutomation\Branch_IFS_Documents_Final\Libraries\GeneralLibraries\BusinessFunction.vbs" SourceLine="-1" >
<Disp><![CDATA[BTN_Log In.Exist]]></Disp>
</NodeArgs>
</Step>
<NodeArgs eType="Context" icon="8" nRep="55" Source="C:\IFSAutomation\Branch_IFS_Documents_Final\Libraries\GeneralLibraries\BusinessFunction.vbs" SourceLine="-1" >
<Disp><![CDATA[Login]]></Disp>
</NodeArgs>
</Step>
<NodeArgs eType="Context" icon="5" nRep="54" Source="C:\IFSAutomation\Branch_IFS_Documents_Final\Libraries\GeneralLibraries\BusinessFunction.vbs" SourceLine="-1" >
<Disp><![CDATA[Login]]></Disp>
</NodeArgs>
</Step>
<Step rID="T22">
<Obj ><![CDATA[Login]]></Obj>
<Details ><![CDATA[]]></Details>
<Time><![CDATA[20-09-2016 - 16:37:37]]></Time>
<TimeTick>1474369657</TimeTick>
<NodeArgs eType="User" icon="7" nRep="57" status="Failed" Source="C:\IFSAutomation\Branch_IFS_Documents_Final\Libraries\GeneralLibraries\BusinessFunction.vbs" SourceLine="-1" >
<Disp><![CDATA[Login]]></Disp>
</NodeArgs>
</Step>
<Step rID="T23">
<Obj plainTxt="False" ><![CDATA[Work Queue]]></Obj>
<Details plainTxt="False" ><![CDATA[Browser]]></Details>
<Time><![CDATA[20-09-2016 - 16:38:37]]></Time>
<TimeTick>1474369717</TimeTick>
<Step rID="T24">
<Obj plainTxt="False" ><![CDATA[Work Queue]]></Obj>
<Details plainTxt="False" ><![CDATA[Page]]></Details>
<Time><![CDATA[20-09-2016 - 16:38:37]]></Time>
<TimeTick>1474369717</TimeTick>
<Step rID="T25">
<Obj plainTxt="False" ><![CDATA[TAB _Home.Exist]]></Obj>
<Details plainTxt="False" ><![CDATA["Object does not exist"]]></Details>
<Time><![CDATA[20-09-2016 - 16:38:37]]></Time>
<TimeTick>1474369717</TimeTick>
<NodeArgs eType="Replay" icon="11" nRep="67" Source="C:\IFSAutomation\Branch_IFS_Documents_Final\Libraries\GeneralLibraries\BusinessFunction.vbs" SourceLine="-1" >
<Disp><![CDATA[TAB _Home.Exist]]></Disp>
</NodeArgs>
</Step>
<Step rID="T26">
<Obj plainTxt="False" ><![CDATA[TAB _Home.Exist]]></Obj>
<Details plainTxt="False" ><![CDATA["Object does not exist"]]></Details>
<Time><![CDATA[20-09-2016 - 16:39:37]]></Time>
<TimeTick>1474369777</TimeTick>
<NodeArgs eType="Replay" icon="11" nRep="75" Source="C:\IFSAutomation\Branch_IFS_Documents_Final\Libraries\GeneralLibraries\BusinessFunction.vbs" SourceLine="-1" >
<Disp><![CDATA[TAB _Home.Exist]]></Disp>
</NodeArgs>
</Step>
<NodeArgs eType="Context" icon="8" nRep="66" Source="C:\IFSAutomation\Branch_IFS_Documents_Final\Libraries\GeneralLibraries\BusinessFunction.vbs" SourceLine="-1" >
<Disp><![CDATA[Work Queue]]></Disp>
</NodeArgs>
</Step>
<NodeArgs eType="Context" icon="5" nRep="65" Source="C:\IFSAutomation\Branch_IFS_Documents_Final\Libraries\GeneralLibraries\BusinessFunction.vbs" SourceLine="-1" >
<Disp><![CDATA[Work Queue]]></Disp>
</NodeArgs>
</Step>
<Step rID="T27">
<Obj ><![CDATA[Login]]></Obj>
<Details ><![CDATA[]]></Details>
<Time><![CDATA[20-09-2016 - 16:39:37]]></Time>
<TimeTick>1474369777</TimeTick>
<NodeArgs eType="User" icon="7" nRep="76" status="Failed" Source="C:\IFSAutomation\Branch_IFS_Documents_Final\Libraries\GeneralLibraries\BusinessFunction.vbs" SourceLine="-1" >
<Disp><![CDATA[Login]]></Disp>
</NodeArgs>
</Step>
<Step rID="T28">
<Obj plainTxt="False" ><![CDATA[Work Queue]]></Obj>
<Details plainTxt="False" ><![CDATA[Browser]]></Details>
<Time><![CDATA[20-09-2016 - 16:40:38]]></Time>
<TimeTick>1474369838</TimeTick>
<Step rID="T29">
<Obj plainTxt="False" ><![CDATA[Work Queue]]></Obj>
<Details plainTxt="False" ><![CDATA[Page]]></Details>
<Time><![CDATA[20-09-2016 - 16:40:38]]></Time>
<TimeTick>1474369838</TimeTick>
<Step rID="T30">
<Obj plainTxt="False" ><![CDATA[TAB_Tests.Exist]]></Obj>
<Details plainTxt="False" ><![CDATA["Object does not exist"]]></Details>
<Time><![CDATA[20-09-2016 - 16:40:38]]></Time>
<TimeTick>1474369838</TimeTick>
<NodeArgs eType="Replay" icon="11" nRep="86" >
<Disp><![CDATA[TAB_Tests.Exist]]></Disp>
</NodeArgs>
</Step>
<NodeArgs eType="Context" icon="8" nRep="85" >
<Disp><![CDATA[Work Queue]]></Disp>
</NodeArgs>
</Step>
<NodeArgs eType="Context" icon="5" nRep="84" >
<Disp><![CDATA[Work Queue]]></Disp>
</NodeArgs>
</Step>
<Step rID="T31">
<Obj ><![CDATA[NavigateToSmartyStreetTesting]]></Obj>
<Details ><![CDATA[]]></Details>
<Time><![CDATA[20-09-2016 - 16:40:38]]></Time>
<TimeTick>1474369838</TimeTick>
<NodeArgs eType="User" icon="7" nRep="87" status="Failed" >
<Disp><![CDATA[NavigateToSmartyStreetTesting]]></Disp>
</NodeArgs>
</Step>
<Step rID="T32">
<Obj plainTxt="False" ><![CDATA[Work Queue]]></Obj>
<Details plainTxt="False" ><![CDATA[Browser]]></Details>
<Time><![CDATA[20-09-2016 - 16:41:38]]></Time>
<TimeTick>1474369898</TimeTick>
<Step rID="T33">
<Obj plainTxt="False" ><![CDATA[Work Queue]]></Obj>
<Details plainTxt="False" ><![CDATA[Page]]></Details>
<Time><![CDATA[20-09-2016 - 16:41:38]]></Time>
<TimeTick>1474369898</TimeTick>
<Step rID="T34">
<Obj plainTxt="False" ><![CDATA[LNK_SmartyStreetsTesting.Exist]]></Obj>
<Details plainTxt="False" ><![CDATA["Object does not exist"]]></Details>
<Time><![CDATA[20-09-2016 - 16:41:38]]></Time>
<TimeTick>1474369898</TimeTick>
<NodeArgs eType="Replay" icon="11" nRep="103" >
<Disp><![CDATA[LNK_SmartyStreetsTesting.Exist]]></Disp>
</NodeArgs>
</Step>
<NodeArgs eType="Context" icon="8" nRep="102" >
<Disp><![CDATA[Work Queue]]></Disp>
</NodeArgs>
</Step>
<NodeArgs eType="Context" icon="5" nRep="101" >
<Disp><![CDATA[Work Queue]]></Disp>
</NodeArgs>
</Step>
<Step rID="T35">
<Obj ><![CDATA[NavigateToSmartyStreetTesting]]></Obj>
<Details ><![CDATA[]]></Details>
<Time><![CDATA[20-09-2016 - 16:41:38]]></Time>
<TimeTick>1474369898</TimeTick>
<NodeArgs eType="User" icon="7" nRep="104" status="Failed" >
<Disp><![CDATA[NavigateToSmartyStreetTesting]]></Disp>
</NodeArgs>
</Step>
<Step rID="T36">
<Obj plainTxt="False" ><![CDATA[Work Queue]]></Obj>
<Details plainTxt="False" ><![CDATA[Browser]]></Details>
<Time><![CDATA[20-09-2016 - 16:42:39]]></Time>
<TimeTick>1474369959</TimeTick>
<Step rID="T37">
<Obj plainTxt="False" ><![CDATA[Work Queue]]></Obj>
<Details plainTxt="False" ><![CDATA[Page]]></Details>
<Time><![CDATA[20-09-2016 - 16:42:39]]></Time>
<TimeTick>1474369959</TimeTick>
<Step rID="T38">
<Obj plainTxt="False" ><![CDATA[LNK_SmartyStreetsTesting.Exist]]></Obj>
<Details plainTxt="False" ><![CDATA["Object does not exist"]]></Details>
<Time><![CDATA[20-09-2016 - 16:42:39]]></Time>
<TimeTick>1474369959</TimeTick>
<NodeArgs eType="Replay" icon="11" nRep="120" >
<Disp><![CDATA[LNK_SmartyStreetsTesting.Exist]]></Disp>
</NodeArgs>
</Step>
<NodeArgs eType="Context" icon="8" nRep="119" >
<Disp><![CDATA[Work Queue]]></Disp>
</NodeArgs>
</Step>
<NodeArgs eType="Context" icon="5" nRep="118" >
<Disp><![CDATA[Work Queue]]></Disp>
</NodeArgs>
</Step>
<Step rID="T39">
<Obj ><![CDATA[NavigateToSmartyStreetTesting]]></Obj>
<Details ><![CDATA[]]></Details>
<Time><![CDATA[20-09-2016 - 16:42:39]]></Time>
<TimeTick>1474369959</TimeTick>
<NodeArgs eType="User" icon="7" nRep="121" status="Failed" >
<Disp><![CDATA[NavigateToSmartyStreetTesting]]></Disp>
</NodeArgs>
</Step>
<Step rID="T40">
<Obj plainTxt="False" ><![CDATA[SmartyStreetsTesting]]></Obj>
<Details plainTxt="False" ><![CDATA[Browser]]></Details>
<Time><![CDATA[20-09-2016 - 16:43:54]]></Time>
<TimeTick>1474370034</TimeTick>
<Step rID="T41">
<Obj plainTxt="False" ><![CDATA[SmartyStreetsTesting]]></Obj>
<Details plainTxt="False" ><![CDATA[Page]]></Details>
<Time><![CDATA[20-09-2016 - 16:43:54]]></Time>
<TimeTick>1474370034</TimeTick>
<Step rID="T42">
<Obj plainTxt="False" ><![CDATA["LBL_LegalAddress"- Description mismatch]]></Obj>
<Details plainTxt="False" ><![CDATA[The object was not found using the test object description. Check the object's properties.]]></Details>
<Time><![CDATA[20-09-2016 - 16:43:54]]></Time>
<TimeTick>1474370034</TimeTick>
<NodeArgs eType="Replay" icon="11" nRep="607" status="Warning" >
<Disp><![CDATA["LBL_LegalAddress"- Description mismatch]]></Disp>
</NodeArgs>
</Step>
<Step rID="T43">
<Obj plainTxt="False" ><![CDATA["LBL_LegalAddress"- Smart Identification]]></Obj>
<Details plainTxt="False" ><![CDATA[<P><span class="text">The smart identification mechanism was invoked.</span></P><P><SPAN class=text>Reason: object not found.</SPAN></P>           <SPAN class=text><b>Original description:</b></SPAN><br>micclass=WebElement<br>innertext=Legal Address<br>html tag=DIV<br><P><FONT face=Verdana size=2><SPAN class=text><B>Smart Identification Alternative Description: </B></SPAN></FONT></P><FONT face=Verdana size=2><u>Base filter properties (4 objects found)&nbsp;</FONT></u><br>
micclass=WebElement<br>html tag=DIV<br><br><FONT face=Verdana size=2><u>Optional filter properties</FONT></u><br>
html id=<SPAN class=passed> (Used</SPAN>, 1 matches)</SPAN><br>class=<SPAN class=warning> (Ignored)<FONT color=#000000></FONT></SPAN><br>innertext=Legal Address<SPAN class=warning> (Ignored)<FONT color=#000000></FONT></SPAN><br>visible=1<SPAN class=warning> (Ignored)<FONT color=#000000></FONT></SPAN><br>]]></Details>
<Time><![CDATA[20-09-2016 - 16:43:54]]></Time>
<TimeTick>1474370034</TimeTick>
<NodeArgs eType="Replay" icon="12" nRep="608" >
<Disp><![CDATA["LBL_LegalAddress"- Smart Identification]]></Disp>
</NodeArgs>
</Step>
<Step rID="T44">
<Obj plainTxt="False" ><![CDATA[LBL_LegalAddress.Exist]]></Obj>
<Details plainTxt="False" ><![CDATA["Object exists"]]></Details>
<Time><![CDATA[20-09-2016 - 16:43:54]]></Time>
<TimeTick>1474370034</TimeTick>
<NodeArgs eType="Replay" icon="11" nRep="609" >
<Disp><![CDATA[LBL_LegalAddress.Exist]]></Disp>
</NodeArgs>
</Step>
<NodeArgs eType="Context" icon="8" nRep="606" status="Warning" >
<Disp><![CDATA[SmartyStreetsTesting]]></Disp>
</NodeArgs>
</Step>
<NodeArgs eType="Context" icon="5" nRep="605" status="Warning" >
<Disp><![CDATA[SmartyStreetsTesting]]></Disp>
</NodeArgs>
</Step>
<Step rID="T45">
<Obj ><![CDATA[VerifyReadOnlyValuesInSmartyStreets]]></Obj>
<Details ><![CDATA[]]></Details>
<Time><![CDATA[20-09-2016 - 16:43:54]]></Time>
<TimeTick>1474370034</TimeTick>
<NodeArgs eType="User" icon="7" nRep="610" status="Passed" >
<Disp><![CDATA[VerifyReadOnlyValuesInSmartyStreets]]></Disp>
</NodeArgs>
</Step>
<Step rID="T46">
<Obj plainTxt="False" ><![CDATA[SmartyStreetsTesting]]></Obj>
<Details plainTxt="False" ><![CDATA[Browser]]></Details>
<Time><![CDATA[20-09-2016 - 16:44:54]]></Time>
<TimeTick>1474370094</TimeTick>
<Step rID="T47">
<Obj plainTxt="False" ><![CDATA[SmartyStreetsTesting]]></Obj>
<Details plainTxt="False" ><![CDATA[Page]]></Details>
<Time><![CDATA[20-09-2016 - 16:44:54]]></Time>
<TimeTick>1474370094</TimeTick>
<Step rID="T48">
<Obj plainTxt="False" ><![CDATA[TXT_LA_Address.Exist]]></Obj>
<Details plainTxt="False" ><![CDATA["Object does not exist"]]></Details>
<Time><![CDATA[20-09-2016 - 16:44:54]]></Time>
<TimeTick>1474370094</TimeTick>
<NodeArgs eType="Replay" icon="9" nRep="1101" >
<Disp><![CDATA[TXT_LA_Address.Exist]]></Disp>
</NodeArgs>
</Step>
<NodeArgs eType="Context" icon="8" nRep="1100" >
<Disp><![CDATA[SmartyStreetsTesting]]></Disp>
</NodeArgs>
</Step>
<NodeArgs eType="Context" icon="5" nRep="1099" >
<Disp><![CDATA[SmartyStreetsTesting]]></Disp>
</NodeArgs>
</Step>
<Step rID="T49">
<Obj ><![CDATA[VerifyReadOnlyValuesInSmartyStreets]]></Obj>
<Details ><![CDATA[]]></Details>
<Time><![CDATA[20-09-2016 - 16:44:54]]></Time>
<TimeTick>1474370094</TimeTick>
<NodeArgs eType="User" icon="7" nRep="1102" status="Failed" >
<Disp><![CDATA[VerifyReadOnlyValuesInSmartyStreets]]></Disp>
</NodeArgs>
</Step>
<Step rID="T50">
<Obj plainTxt="False" ><![CDATA[SmartyStreetsTesting]]></Obj>
<Details plainTxt="False" ><![CDATA[Browser]]></Details>
<Time><![CDATA[20-09-2016 - 16:45:55]]></Time>
<TimeTick>1474370155</TimeTick>
<Step rID="T51">
<Obj plainTxt="False" ><![CDATA[SmartyStreetsTesting]]></Obj>
<Details plainTxt="False" ><![CDATA[Page]]></Details>
<Time><![CDATA[20-09-2016 - 16:45:55]]></Time>
<TimeTick>1474370155</TimeTick>
<Step rID="T52">
<Obj plainTxt="False" ><![CDATA[TXT_LA_City.Exist]]></Obj>
<Details plainTxt="False" ><![CDATA["Object does not exist"]]></Details>
<Time><![CDATA[20-09-2016 - 16:45:55]]></Time>
<TimeTick>1474370155</TimeTick>
<NodeArgs eType="Replay" icon="9" nRep="1592" >
<Disp><![CDATA[TXT_LA_City.Exist]]></Disp>
</NodeArgs>
</Step>
<NodeArgs eType="Context" icon="8" nRep="1591" >
<Disp><![CDATA[SmartyStreetsTesting]]></Disp>
</NodeArgs>
</Step>
<NodeArgs eType="Context" icon="5" nRep="1590" >
<Disp><![CDATA[SmartyStreetsTesting]]></Disp>
</NodeArgs>
</Step>
<Step rID="T53">
<Obj ><![CDATA[VerifyReadOnlyValuesInSmartyStreets]]></Obj>
<Details ><![CDATA[]]></Details>
<Time><![CDATA[20-09-2016 - 16:45:55]]></Time>
<TimeTick>1474370155</TimeTick>
<NodeArgs eType="User" icon="7" nRep="1593" status="Failed" >
<Disp><![CDATA[VerifyReadOnlyValuesInSmartyStreets]]></Disp>
</NodeArgs>
</Step>
<Step rID="T54">
<Obj plainTxt="False" ><![CDATA[SmartyStreetsTesting]]></Obj>
<Details plainTxt="False" ><![CDATA[Browser]]></Details>
<Time><![CDATA[20-09-2016 - 16:46:42]]></Time>
<TimeTick>1474370202</TimeTick>
<Step rID="T55">
<Obj plainTxt="False" ><![CDATA[SmartyStreetsTesting]]></Obj>
<Details plainTxt="False" ><![CDATA[Page]]></Details>
<Time><![CDATA[20-09-2016 - 16:46:42]]></Time>
<TimeTick>1474370202</TimeTick>
<Step rID="T56">
<Obj plainTxt="False" ><![CDATA[TXT_LA_State.Exist]]></Obj>
<Details plainTxt="False" ><![CDATA["Object does not exist"]]></Details>
<Time><![CDATA[20-09-2016 - 16:46:42]]></Time>
<TimeTick>1474370202</TimeTick>
<NodeArgs eType="Replay" icon="9" nRep="1934" >
<Disp><![CDATA[TXT_LA_State.Exist]]></Disp>
</NodeArgs>
</Step>
<NodeArgs eType="Context" icon="8" nRep="1933" >
<Disp><![CDATA[SmartyStreetsTesting]]></Disp>
</NodeArgs>
</Step>
<NodeArgs eType="Context" icon="5" nRep="1932" >
<Disp><![CDATA[SmartyStreetsTesting]]></Disp>
</NodeArgs>
</Step>
<Step rID="T57">
<Obj ><![CDATA[VerifyReadOnlyValuesInSmartyStreets]]></Obj>
<Details ><![CDATA[]]></Details>
<Time><![CDATA[20-09-2016 - 16:46:42]]></Time>
<TimeTick>1474370202</TimeTick>
<NodeArgs eType="User" icon="7" nRep="1935" status="Failed" >
<Disp><![CDATA[VerifyReadOnlyValuesInSmartyStreets]]></Disp>
</NodeArgs>
</Step>
<Step rID="T58">
<Obj plainTxt="False" ><![CDATA[SmartyStreetsTesting]]></Obj>
<Details plainTxt="False" ><![CDATA[Browser]]></Details>
<Time><![CDATA[20-09-2016 - 16:46:42]]></Time>
<TimeTick>1474370202</TimeTick>
<Step rID="T59">
<Obj plainTxt="False" ><![CDATA[SmartyStreetsTesting]]></Obj>
<Details plainTxt="False" ><![CDATA[Page]]></Details>
<Time><![CDATA[20-09-2016 - 16:46:42]]></Time>
<TimeTick>1474370202</TimeTick>
<Step rID="T60">
<Obj plainTxt="False" ><![CDATA[TXT_LA_Zip.Exist]]></Obj>
<Details plainTxt="False" ><![CDATA["Object does not exist"]]></Details>
<Time><![CDATA[20-09-2016 - 16:46:42]]></Time>
<TimeTick>1474370202</TimeTick>
<NodeArgs eType="Replay" icon="9" nRep="1940" >
<Disp><![CDATA[TXT_LA_Zip.Exist]]></Disp>
</NodeArgs>
</Step>
<NodeArgs eType="Context" icon="8" nRep="1939" >
<Disp><![CDATA[SmartyStreetsTesting]]></Disp>
</NodeArgs>
</Step>
<NodeArgs eType="Context" icon="5" nRep="1938" >
<Disp><![CDATA[SmartyStreetsTesting]]></Disp>
</NodeArgs>
</Step>
<Step rID="T61">
<Obj ><![CDATA[VerifyReadOnlyValuesInSmartyStreets]]></Obj>
<Details ><![CDATA[]]></Details>
<Time><![CDATA[20-09-2016 - 16:46:42]]></Time>
<TimeTick>1474370202</TimeTick>
<NodeArgs eType="User" icon="7" nRep="1941" status="Failed" >
<Disp><![CDATA[VerifyReadOnlyValuesInSmartyStreets]]></Disp>
</NodeArgs>
</Step>
<Step rID="T62">
<Obj plainTxt="False" ><![CDATA[SmartyStreetsTesting]]></Obj>
<Details plainTxt="False" ><![CDATA[Browser]]></Details>
<Time><![CDATA[20-09-2016 - 16:46:42]]></Time>
<TimeTick>1474370202</TimeTick>
<Step rID="T63">
<Obj plainTxt="False" ><![CDATA[SmartyStreetsTesting]]></Obj>
<Details plainTxt="False" ><![CDATA[Page]]></Details>
<Time><![CDATA[20-09-2016 - 16:46:42]]></Time>
<TimeTick>1474370202</TimeTick>
<Step rID="T64">
<Obj plainTxt="False" ><![CDATA["TXT_EA_Street"- Description mismatch]]></Obj>
<Details plainTxt="False" ><![CDATA[The object was not found using the test object description. Check the object's properties.]]></Details>
<Time><![CDATA[20-09-2016 - 16:46:42]]></Time>
<TimeTick>1474370202</TimeTick>
<NodeArgs eType="Replay" icon="9" nRep="1945" status="Warning" >
<Disp><![CDATA["TXT_EA_Street"- Description mismatch]]></Disp>
</NodeArgs>
</Step>
<Step rID="T65">
<Obj plainTxt="False" ><![CDATA["TXT_EA_Street"- Smart Identification]]></Obj>
<Details plainTxt="False" ><![CDATA[<P><span class="text">The smart identification mechanism was invoked.</span></P><P><SPAN class=text>Reason: object not found.</SPAN></P>           <SPAN class=text><b>Original description:</b></SPAN><br>type=text<br>name=.*.N_EmployerLine1<br>micclass=WebEdit<br>html tag=INPUT<br><P><FONT face=Verdana size=2><SPAN class=text><B>Smart Identification Alternative Description: </B></SPAN></FONT></P><FONT face=Verdana size=2><u>Base filter properties (1 objects found)&nbsp;</FONT></u><br>
type=text<br>micclass=WebEdit<br>html tag=INPUT<br>]]></Details>
<Time><![CDATA[20-09-2016 - 16:46:42]]></Time>
<TimeTick>1474370202</TimeTick>
<NodeArgs eType="Replay" icon="12" nRep="1946" >